{
  "schema_version": 1,
  "id": "opencode",
  "sort_order": 40,
  "name": "OpenCode",
  "remark": "网关会接管 OpenCode 内置的 anthropic 与 openai 服务商；在 OpenCode 中选择 anthropic 与 openai 的模型即可。",
  "remark_en": "The gateway takes over OpenCode's built-in anthropic and openai providers; just pick anthropic and openai models in OpenCode.",
  "icon": {
    "view_box": "0 0 512 512",
    "paths": [
      {
        "d": "M0 0H512V512H0Z",
        "fill": "#131010"
      },
      {
        "d": "M320 224V352H192V224H320Z",
        "fill": "#5A5858"
      },
      {
        "d": "M384 416H128V96H384V416ZM320 160H192V352H320V160Z",
        "fill": "#FFFFFF",
        "fill_rule": "evenodd"
      }
    ]
  },
  "config_dir": "~/.config/opencode",
  "user_agent": ["opencode"],
  "protocols": ["openai_responses", "anthropic_messages"],
  "features": {
    "provider_config": {
      "enabled": true,
      "operations": [
        {
          "id": "set-schema",
          "op": "set",
          "file": "opencode.json",
          "format": "json",
          "path": ["$schema"],
          "value": "https://opencode.ai/config.json"
        },
        {
          "id": "set-anthropic-endpoint",
          "op": "set",
          "file": "opencode.json",
          "format": "json",
          "path": ["provider", "anthropic", "options", "baseURL"],
          "value": "{target.endpoint}/v1"
        },
        {
          "id": "set-anthropic-token",
          "op": "set",
          "file": "opencode.json",
          "format": "json",
          "path": ["provider", "anthropic", "options", "apiKey"],
          "value": "{target.token}"
        },
        {
          "id": "set-openai-endpoint",
          "op": "set",
          "file": "opencode.json",
          "format": "json",
          "path": ["provider", "openai", "options", "baseURL"],
          "value": "{target.endpoint}"
        },
        {
          "id": "set-openai-token",
          "op": "set",
          "file": "opencode.json",
          "format": "json",
          "path": ["provider", "openai", "options", "apiKey"],
          "value": "{target.token}"
        }
      ]
    },
    "global_preset": {
      "enabled": true,
      "file": "opencode.json",
      "format": "json"
    },
    "profiles": { "enabled": false },
    "official_login": { "enabled": false },
    "model_mapping": { "enabled": true },
    "token_usage": { "enabled": true },
    "skills": { "enabled": true, "directory": "skills" },
    "mcp": {
      "enabled": true,
      "file": "opencode.json",
      "format": "json",
      "adapter": "opencode",
      "servers_path": ["mcp"]
    },
    "sessions": { "enabled": true, "adapter": "opencode" },
    "plugins": { "enabled": false },
    "prompts": { "enabled": true, "file": "AGENTS.md" }
  }
}
